{
  "bind": "127.0.0.1",
  "port": 8788,
  "request_read_timeout_seconds": 15,
  "max_concurrent_requests": 32,
  "audit_log": "~/.agent-security-gateway/audit.jsonl",
  "run_store": {
    "path": "~/.agent-security-gateway/runs.jsonl",
    "max_ttl_seconds": 604800
  },
  "artifact_store": {
    "path": "~/.agent-security-gateway/artifacts",
    "max_artifact_bytes": 10485760,
    "retention_days": 90
  },
  "kill_switch_file": "~/.agent-security-gateway/KILL_SWITCH",
  "require_known_run_id": true,
  "agents": {
    "mac_gpt55": {
      "token_sha256": "0000000000000000000000000000000000000000000000000000000000000000",
      "trust_tier": "privileged_core",
      "allowed_client_cidrs": ["127.0.0.1/32", "192.168.10.10/32"],
      "allowed_capabilities": ["inspect", "delegate_web_research", "search_trusted_knowledge", "download_artifact", "review_artifact", "register_run"],
      "allowed_routes": [
        "security.inspect_only",
        "security.runs.register",
        "pi.web_research.chat",
        "ubuntu1.knowledge.search_trusted",
        "security.artifacts.download",
        "security.artifacts.review_summary"
      ]
    },
    "pi_research_1": {
      "token_sha256": "1111111111111111111111111111111111111111111111111111111111111111",
      "trust_tier": "web_dmz",
      "allowed_client_cidrs": ["127.0.0.1/32", "192.168.30.11/32"],
      "allowed_capabilities": ["inspect", "submit_source_card", "submit_artifact", "notify_audited_result", "request_x_research"],
      "allowed_routes": [
        "security.inspect_only",
        "ubuntu1.knowledge.submit_source_card",
        "security.artifacts.submit",
        "mac.result_receipt.notify",
        "mac.x_research.request"
      ]
    },
    "human_operator": {
      "token_sha256": "3333333333333333333333333333333333333333333333333333333333333333",
      "trust_tier": "human_control",
      "allowed_client_cidrs": ["127.0.0.1/32", "192.168.10.10/32"],
      "allowed_capabilities": ["inspect", "approve_action", "review_quarantined_artifact"],
      "allowed_routes": ["security.inspect_only", "security.approvals.create", "security.artifacts.review"]
    }
  },
  "routes": {
    "security.inspect_only": {
      "kind": "inspect_only",
      "aliases": ["asg/inspect-only"],
      "allowed_callers": ["*"],
      "required_capability": "inspect",
      "input_policy": {
        "accepted_taint": ["trusted_instruction", "untrusted_web", "sandbox_output", "model_output"],
        "allow_missing_taint": true
      }
    },
    "security.approvals.create": {
      "kind": "inspect_only",
      "aliases": ["asg/approvals-create"],
      "allowed_callers": ["human_operator"],
      "required_capability": "approve_action",
      "input_policy": {
        "accepted_taint": ["human_approved"],
        "allow_missing_taint": true
      }
    },
    "security.runs.register": {
      "kind": "inspect_only",
      "aliases": ["asg/runs-register"],
      "allowed_callers": ["mac_gpt55"],
      "required_capability": "register_run",
      "input_policy": {
        "accepted_taint": ["trusted_instruction", "human_approved"],
        "allow_missing_taint": true
      }
    },
    "security.artifacts.submit": {
      "kind": "inspect_only",
      "aliases": ["asg/artifacts-submit"],
      "allowed_callers": ["pi_research_1"],
      "required_capability": "submit_artifact",
      "input_policy": {
        "accepted_taint": ["untrusted_web", "untrusted_pdf", "untrusted_github", "sandbox_output", "model_output"],
        "allow_missing_taint": false,
        "require_message_type": "artifact"
      },
      "artifact_policy": {
        "allowed_operations": ["submit"],
        "max_artifact_bytes": 10485760
      }
    },
    "security.artifacts.download": {
      "kind": "inspect_only",
      "aliases": ["asg/artifacts-download"],
      "allowed_callers": ["mac_gpt55"],
      "required_capability": "download_artifact",
      "input_policy": {
        "accepted_taint": ["untrusted_web", "untrusted_pdf", "untrusted_github", "sandbox_output", "model_output", "promoted_knowledge"],
        "allow_missing_taint": false
      },
      "artifact_policy": {
        "allowed_operations": ["metadata", "content"],
        "allowed_statuses": ["verified"]
      }
    },
    "security.artifacts.review_summary": {
      "kind": "artifact_review",
      "aliases": ["asg/artifacts-review-summary"],
      "backend": {
        "mode": "http",
        "base_url": "http://mac-controller.internal:8642/v1",
        "path": "/chat/completions",
        "api_key_env": "MAC_ARTIFACT_REVIEW_BACKEND_KEY",
        "timeout_seconds": 120,
        "model_rewrite": "local-artifact-reviewer",
        "max_tokens": 800,
        "max_review_chars": 40000
      },
      "allowed_callers": ["mac_gpt55"],
      "required_capability": "review_artifact",
      "input_policy": {
        "accepted_taint": ["untrusted_web", "untrusted_pdf", "untrusted_github", "sandbox_output", "model_output"],
        "allow_missing_taint": false
      },
      "artifact_policy": {
        "allowed_operations": ["review"],
        "allowed_statuses": ["verified"]
      }
    },
    "security.artifacts.review": {
      "kind": "inspect_only",
      "aliases": ["asg/artifacts-review"],
      "allowed_callers": ["human_operator"],
      "required_capability": "review_quarantined_artifact",
      "input_policy": {
        "accepted_taint": ["untrusted_web", "untrusted_pdf", "untrusted_github", "sandbox_output", "model_output"],
        "allow_missing_taint": false
      },
      "artifact_policy": {
        "allowed_operations": ["metadata", "content"],
        "allowed_statuses": ["needs_review"]
      }
    },
    "pi.web_research.chat": {
      "kind": "openai_chat_completions",
      "aliases": ["asg/pi-web-research"],
      "backend": {
        "mode": "http",
        "base_url": "http://pi1-agent.internal:8000/v1",
        "path": "/chat/completions",
        "api_key_env": "PI1_AGENT_BACKEND_KEY",
        "timeout_seconds": 180,
        "model_rewrite": "pi-web-research-agent"
      },
      "allowed_callers": ["mac_gpt55"],
      "required_capability": "delegate_web_research",
      "input_policy": {
        "accepted_taint": ["trusted_instruction"],
        "allow_missing_taint": false
      }
    },
    "ubuntu1.knowledge.search_trusted": {
      "kind": "http_json",
      "backend": {
        "mode": "http",
        "base_url": "http://ubuntu1-knowledge.internal:8801",
        "path": "/api/search/trusted",
        "method": "POST",
        "api_key_env": "UBUNTU1_KB_BACKEND_KEY",
        "timeout_seconds": 60
      },
      "allowed_callers": ["mac_gpt55"],
      "required_capability": "search_trusted_knowledge",
      "input_policy": {
        "accepted_taint": ["trusted_instruction", "promoted_knowledge"],
        "allow_missing_taint": false
      }
    },
    "ubuntu1.knowledge.submit_source_card": {
      "kind": "http_json",
      "backend": {
        "mode": "http",
        "base_url": "http://ubuntu1-knowledge.internal:8801",
        "path": "/api/staging/source-card",
        "method": "POST",
        "api_key_env": "UBUNTU1_STAGING_BACKEND_KEY",
        "timeout_seconds": 60
      },
      "allowed_callers": ["pi_research_1"],
      "required_capability": "submit_source_card",
      "input_policy": {
        "accepted_taint": ["untrusted_web"],
        "allow_missing_taint": false,
        "require_message_type": "source_card",
        "allow_raw_external_content": false
      }
    },
    "mac.result_receipt.notify": {
      "kind": "openai_chat_completions",
      "backend": {
        "mode": "http",
        "base_url": "http://mac-controller.internal:8642/v1",
        "path": "/chat/completions",
        "api_key_env": "MAC_HERMES_BACKEND_KEY",
        "require_signature": false,
        "timeout_seconds": 120,
        "model_rewrite": "hermes-agent"
      },
      "allowed_callers": ["pi_research_1"],
      "required_capability": "notify_audited_result",
      "input_policy": {
        "accepted_taint": ["untrusted_web", "sandbox_output", "model_output"],
        "allow_missing_taint": false,
        "allow_raw_external_content": false
      },
      "report_policy": {
        "forward_audit_receipt": true,
        "return_audit_receipt": true,
        "include_structured_extract": false,
        "notify_on_block": true,
        "max_receipts_per_minute": 20
      }
    },
    "mac.x_research.request": {
      "kind": "openai_chat_completions",
      "aliases": ["asg/mac-x-research"],
      "backend": {
        "mode": "http",
        "base_url": "http://mac-controller.internal:8642/v1",
        "path": "/chat/completions",
        "api_key_env": "MAC_HERMES_BACKEND_KEY",
        "timeout_seconds": 120,
        "model_rewrite": "hermes-agent",
        "max_tokens": 800
      },
      "allowed_callers": ["pi_research_1"],
      "required_capability": "request_x_research",
      "input_policy": {
        "accepted_taint": ["model_output"],
        "allow_missing_taint": false,
        "allow_raw_external_content": false,
        "disallow_external_urls": true,
        "max_messages": 0,
        "require_message_type": "x_research_request",
        "require_x_research_request": true,
        "max_x_query_chars": 280,
        "max_x_question_chars": 500,
        "max_x_results": 10
      }
    }
  }
}
